category,author,published_at,body,title,url,source
business,"Topher L. McDougal, The Conversation",2023-10-13T19:50:48+00:00,"International aid groups are warning that they cannot deliver food and other basic services to people in the Gaza Strip and that a “dire” humanitarian crisis is set to worsen.

International aid groups provide food and other means of support to about 63% of people in Gaza.

Israel stopped allowing deliveries of food, fuel and other supplies to Gaza’s 2.3 million residents on Oct. 10, 2023, and is reportedly preparing for a ground invasion.

On Oct. 12, 2023, Israel warned 1.1 million Gaza residents in the northern section of the enclave to leave for the southern region, in advance of a potential ground invasion.

I am a scholar of peace and conflict economics and a former World Bank consultant, including during the 2014 war between Hamas and Israel.

International aid groups now face the same problem in Gaza that local businesses and residents have encountered for about 16 years: a blockade that prevents civilians and items, like medicine from easily moving into or out of the enclosed area, roughly 25 miles long. That 16-year blockade did not apply to the food and fuel that groups brought in to Gaza.

Now, it does.

Gaza’s blockade and economy

Gaza is about the size of Philadelphia and requires trade with different businesses and countries in order to maintain and grow its economy.

But Gaza is heavily dependent on foreign aid.

This is partially the result of Israel setting up permanent air, land and sea blockades around Gaza in 2007, one year after Hamas rose to political power. Egypt, which borders Gaza on its southern end, also oversees one checkpoint that specifically limits people coming and going.

While Israel has granted permits to about 17,000 Gaza residents to enter and work in Israel, the food, fuel and medical supplies that people in Gaza use all first pass through Israel.

Israel controls two physical checkpoints along Gaza, which monitor both the entry and exit of people and trucks. Israel limits the kind and quantity of materials that pass into Gaza. And the blockades generally prohibit Gazans who do not have work permits or special clearance – for medical purposes, for example – from entering Israel.

Israel’s restrictions through the blockade intensified since Hamas’ surprise attack on 20 Israeli towns and several military bases on Oct. 7, with Israel then announcing a broad blockade of imports into Gaza. This stopped all food, fuel and medical supplies from entering the region.

Gaza’s isolation

The Palestinian enclaves of West Bank and Gaza – which are generally lumped together in economic analyses – both have small economies that run a massive deficit of US$6.6 billion in losses each year, as the value of the imports they receive greatly outweighs the value of the items they produce and sell elsewhere.

More than 53% of Gaza residents were considered below the poverty line in 2020, and about 77% of Gazan households receive some form of aid from the United Nations and other groups, mostly in the form of cash or food.

Gaza’s weak economy is caused by a number of complex factors, but the largest is the blockade and the economic and trade isolation it creates.

For the average Gazan, the blockade has several practical effects, including people’s ability to get food. About 64% of people in Gaza are considered food insecure, meaning they do not have reliable access to sufficient amounts of food.

Food as a percentage of Gaza’s total imports has skyrocketed by 50% since 2005, when Israel first imposed a temporary blockade. And the amount of food the West Bank and Gaza actually produce has tumbled by 30% since then.

It is hard for Gaza to produce food within its own borders. One factor is that Israeli airstrikes hit Gaza’s only power generation plant and main sewage treatment plant in 2008 and again in 2018. These attacks resulted in the spread of sewage waste on land and in the water, destroying farmlands and food crops and threatening fish stocks in the ocean as well.

The UN’s big role in Gaza

Gaza’s weak economy and isolation because of the blockade mean that it relies heavily on international aid organizations to provide basic services to residents. The biggest of these aid groups in Gaza is the United Nations Relief and Works Agency for Palestine Refugees in the Near East – also known as UNRWA.

Today, UNRWA is the second-largest employer in Gaza, following Hamas. It provides the bulk of the education, food aid and health care services for people in Gaza, in addition to 3 million other people registered as Palestinian refugees who live in Jordan, Lebanon, Syria, the West Bank and other places.

Over time, UNRWA has evolved into a kind of parallel government, alongside Hamas, which Israel, the United States and other countries designate as a terrorist organization.

UNRWA funds and runs a network of 284 schools in Gaza alone, employing over 9,000 local people as staff and educating over 294,000 children each year.

UNRWA runs 22 hospitals in Gaza that employ almost 1,000 health staff and has 3.3 million patient visits per year.

Its schools are converted into humanitarian shelters in times of crisis, such as the current war. People can go there to get clean water, food, mattresses and blankets, showers and more.

The number of people in Gaza who are displaced from their homes has quickly risen over the last few days, totaling over 330,000 on Oct. 12, 2023. Over two-thirds of these people are staying in UNRWA schools.

A complicated US relationship

The U.S. has historically been the single-largest funder of UNRWA, a U.N. agency that relies on governments to support its work. The U.S. gave more than $500 million to Palestinians from April 2021 through March 2022, including more than $417 million that went to UNRWA.

U.S. support to UNRWA has fluctuated throughout different presidential administrations.

Total U.S. aid to the West Bank and Gaza peaked at $1 billion in 2009 – after Israel sealed off the territory. It reached $1 billion in annual contributions again in 2013, when former Secretary of State John Kerry helped restart peace talks between Israel and Hamas.

In 2018, the Trump Administration cut almost all of the money the U.S. typically gives to UNRWA, amounting to roughly 30% of the organization’s total budget.

Defenders of the policy change cited UNRWA-published textbooks that allegedly glorified jihad. UNRWA, for its part, maintained that, as an outside organization, it can only use the educational materials the country it is working in wants.

The Biden administration then restored funding to UNRWA and other organizations helping Palestinians in 2021.

Some Republican politicians have said that UNRWA has “cozied up” to Hamas. And an internal UNRWA ethics committee has accused top staff at the agency of “sexual misconduct, nepotism, retaliation … and other abuses of authority” that created a toxic work environment.

Meanwhile, since the war between Israel and Hamas began on Oct. 8, more than 1,500 Gazans have been killed and more than 5,300 injured, while Hamas attacks have killed more than 1,300 people in Israel and injured about 3,200 others.

International aid groups and European Union officials have called for a humanitarian corridor to be set up in Gaza – meaning a protected path specifically for civilians, aid workers and necessary basic items to pass through safely back and forth from Gaza to Israel and Egypt. So far, there are no clear plans for such a protected pathway.

Topher L. McDougal is Professor of Economic Development & Peacebuilding, University of San Diego.

This article is republished from The Conversation under a Creative Commons license. Read the original article.","Israel's blockade of Gaza means that a region the size of Philadelphia faces a real risk of starvation, says Peace Studies scholar",https://fortune.com/2023/10/13/israel-blockade-gaza-hamas-war-starvation-food-insecurity/,Fortune
business,,2023-10-06T20:17:00+00:00,"Witness Adam Yedidia answers questions during Sam Bankman-Fried fraud trial over the collapse of FTX, the bankrupt cryptocurrency exchange, at Federal Court in New York City, October 5, 2023, in this courtroom sketch. Jane Rosenberg | Reuters

Two of Sam Bankman-Fried's former friends from MIT, who also worked at crypto exchange FTX while living with the company's founder in the Bahamas, took the stand in a Manhattan courtroom this week to testify against their former classmate, confidant, and boss — a man who allegedly ran a crypto empire that defrauded thousands of customers out of billions of dollars. Gary Wang, the lesser-known co-founder of FTX, was asked by Assistant U.S. Attorney Nicolas Roos on Thursday, ""Did you commit financial crimes while working at FTX?"" ""Yes,"" responded Wang. He said that his crimes, including wire and commodities fraud, were carried out with the help of Bankman-Fried, FTX ex-engineering head Nishad Singh and Caroline Ellison, who ran sister hedge fund Alameda Research and had been Bankman-Fried's girlfriend. ""Mr. Wang, do you see any of the people you committed those crimes with in the courtroom today?"" Roos continued. Wang, dressed in an oversized and wrinkled suit with a red tie and glasses, awkwardly stood up and looked around the courtroom before responding, ""Yes."" ""Who do you see?"" asked Roos. ""Sam Bankman-Fried,"" he said. The trial, set to last six weeks, will resume on Tuesday with key testimony expected from Ellison, who is considered the prosecution's star witness, having already pleaded guilty to multiple charges. Bankman-Fried faces seven federal charges, including wire fraud, securities fraud and money laundering, that could put him in prison for the rest of his life. Thus far, Bankman-Fried, 31, has remained mostly quiet in court intently listening to witnesses and at times writing notes to his attorneys. But as Wang testified against him, Bankman-Fried looked visibly upset, shifting his gaze from his former friend to the ground, and at one point putting his head in his hands.

Sam Bankman-Fried listens as Assistant U.S. Attorney Nicolas Roos questions Gary Wang during Bankman-Fried's fraud trial over the collapse of FTX, the bankrupt cryptocurrency exchange, at Federal Court in New York City, U.S., October 6, 2023, in this courtroom sketch. Jane Rosenberg | Reuters

Wang, 30, was technology chief for FTX, which spiraled into bankruptcy in November. He spoke so fast that U.S. District Judge Lewis Kaplan and the prosecutor both stopped him at points to ask that he slow his pace. Much of Wang's testimony on Friday focused on the final days at FTX before the entire operation imploded, including reports in the media detailing Alameda's business practices and its troubling ties to FTX. Wang said that in response to the reporting an emergency meeting was called between Bankman-Fried, Wang and Singh, to discuss shutting down Alameda. He said they ultimately decided against such a move, because he and Bankman-Fried were aware that Alameda had no way to repay the roughly $14 billion hole in its books. Prosecutors took the jury through a series of tweets, beginning on Nov. 7. Posts came from the company blaming bank hours for slow withdrawals, while Bankman-Fried tweeted from his personal account, assuring customers that all was fine. ""FTX was not fine and assets were not fine,"" Wang testified. On Nov. 12, after FTX declared bankruptcy, Bankman-Fried asked Wang to drive with him to the Bahamas Securities Commission for a meeting. On the drive, Bankman-Fried told Wang to transfer assets to Bahamian liquidators because he believed they would allow him to maintain control of the company. Wang said he wasn't in the meeting with the securities authority, though Bankman-Fried's dad was present.



Wang said he returned to the U.S. and met with prosecutors the next day. He faces up to 50 years in prison when he faces a judge for sentencing following this trial. He told jurors he signed a six-page cooperation agreement that requires him to meet with prosecutors, answer their questions truthfully and turn over evidence.

Sam Bankman-Fried, the founder of bankrupt cryptocurrency exchange FTX, is seen during a hearing as a U.S judge revoked his bail, at a courthouse in New York, U.S., August 11, 2023 in this courtroom sketch. Jane Rosenberg | Reuters

$65 billion line of credit

For months, Bankman-Fried has known that Wang and Ellison, who were integral members of his personal and professional inner circles, had turned on him. Both pleaded guilty in December and have since been cooperating with the U.S. attorney's office in Manhattan. Wang's testimony, which stretched into Friday, was given under a cooperation agreement with the government. Ellison is expected to take the stand under a similar arrangement.

U.S. District Judge Lewis Kaplan presides as Gary Wang testifies during the fraud trial of Sam Bankman-Fried over the collapse of FTX, the bankrupt cryptocurrency exchange, at Federal Court in New York City, U.S., October 6, 2023 in this courtroom sketch. Jane Rosenberg | Reuters

Born in China, Wang moved to the U.S. at age 7, and grew up in Minnesota before going to the Massachusetts Institute of Technology to study math and computer science. He worked at Google after college. Wang, who first met Bankman-Fried during high school at a summer camp, owned 10% of Alameda, while his boss owned the other 90%. Wang told the court about the advantages that Alameda received by having code baked into FTX's software that allowed special access to the crypto exchange. Those privileges ultimately resulted in Alameda owing FTX $8 billion worth of customer deposits. ""We gave special privileges on FTX that gave unlimited withdrawals on the platform to Alameda,"" Wang said. Alameda was allowed to withdraw and transfer those funds and had a $65 billion line of credit. ""When customers deposited USD, it went to Alameda,"" he said. ""It existed in the computer code. Alameda could have negative balances and unlimited withdrawals."" That ""bug"" in the code was written by Nishad Singh, who was FTX's director of engineering, and reviewed by Wang. Bankman-Fried was calling the shots, Wang said. Wang also told the court about a $1 million personal loan he received and a $200 million to $300 million loan in his name from Alameda that was never deposited into his account, but rather was used to make investments into other companies on behalf of FTX. That was all done by Bankman-Fried, he testified. In early 2020, Wang said he discovered for the first time Alameda's negative balance exceeded FTX's revenue, an indication that Alameda was taking customer funds. Wang said he brought this to Bankman-Fried's attention several times. In late 2021, Wang discovered Alameda had withdrawn $3 billion from its $65 billion line of credit. Wang's compensation was a base salary of $200,000 per year plus stock. He owned roughly 17% of FTX. Even though they were co-founders, ""ultimately it was Sam's decision to make"" when there were disagreements, he said.

Assistant United States Attorney Nicolas Roos questions Gary Wang during Sam Bankman-Fried's fraud trial over the collapse of FTX, the bankrupt cryptocurrency exchange, at Federal Court in New York City, U.S., October 6, 2023, in this courtroom sketch. Jane Rosenberg | Reuters

An $8 billion bug

Adam Yedidia, who was the prosecution's second witness on Wednesday, continued his testimony on Thursday. Yedidia met Bankman-Fried in college at MIT, and the pair remained close friends. Yedidia, assuming a robotic posture on the stand, worked out of FTX's Hong Kong office from January to October of 2021 and then in the Bahamas until last year's collapse. In his testimony, he referred to a group Signal thread called ""People of the House,"" referring to Bankman-Fried's $35 million penthouse, where many employees lived.

Zoom In Icon Arrows pointing outwards Exhibit from the prosecution shows Signal thread called ""People of the House,"" referring to Bankman-Fried's $35 million penthouse, where many employees lived. Source: SDNY

In terms of who was paying the rent, Yedidia recalled Bankman-Fried saying he ""assumed it's just Alameda paying for it in the end."" Yedidia said Bankman-Fried had told him, before he began working in the Bahamas in 2019, that he and Ellison had sex. Bankman-Fried asked Yedidia if it was a good idea for them to date, to which Yedidia said no. Bankman-Fried responded by saying he was expecting that answer. One of Yedidia's responsibilities was fixing the bug in the code that gave Alameda preferential treatment. In June 2022, he submitted a report to Bankman-Fried on Signal that showed $8 billion in customer money held in an internal database tracking the cash wired to an Alameda account called ""fiat at ftx.com"" was missing. Yedidia said he and Bankman-Fried spoke about it at the pickleball court at the resort in Nassau, Bahamas. He asked his boss if things were OK. He was concerned because it ""seemed like a lot of money"" from FTX customers was at risk. ""Sam said, we were bulletproof last year. We aren't bulletproof this year,"" Yedidia testified. Yedidia said he asked when they would be bulletproof again. Bankman-Fried said he wasn't sure, but it may be six months to three years. Yedidia said Bankman-Fried appeared ""worried or nervous,"" which he said was atypical. Still, Yedidia said he trusted Bankman-Fried and Ellison to ""handle the situation."" On cross-examination, Christian Everdell, Bankman-Fried's attorney, focused on how Yedidia was the one responsible for developing and reviewing the code.



He asked about the long hours employees worked and Yedidia's concern for Wang being near burnout. That resulted in Yedidia instituting a rule to not wake Wang at night for bug fixes because he needed sleep. Everdell also drilled Yedidia on his high level of compensation in his less than two years at FTX. His base salary was between $175,000 and $200,000, but he received multiple bonuses of more than $12 million in cash and company equity. Yedidia said he's now teaching math — geometry and algebra — at a high school. He invested most of the millions he earned as bonuses back into FTX, and his equity stake is now worthless. As FTX was failing, Yedidia said he was by Bankman-Fried's side. He highlighted a Signal exchange in November 2022, during which he wrote, ""I love you Sam. I'm not going anywhere."" He said he wrote the message because so many people had left. When asked what changed, Yedidia said he learned that FTX customer deposits had been used to pay loans to creditors. He said Alameda's actions seemed ""flagrantly wrong."" Yedidia's testimony ended on a fiery note, which was later struck from the record. He was asked why he had lost faith in FTX and resigned. ""FTX defrauded all its customers,"" he said.

Matt Huang, co-founder of Paradigm Operations LP, right, arrives at court in New York, US, on Thursday, Oct. 5, 2023. Former FTX Co-Founder Sam Bankman-Fried is charged with seven counts of fraud and money laundering following the collapse of his cryptocurrency empire last year. Photographer: Yuki Iwamura/Bloomberg via Getty Images Yuki Iwamura | Bloomberg | Getty Images

Investment to zero

The third witness to take the stand was Matt Huang, co-founder and managing partner of Paradigm, a crypto venture capital firm that invested over $275 million in FTX. That stake was wiped out. Huang testified about his firm's due diligence on FTX, and he told the court that Bankman-Fried assured him that funds would be used for FTX and not Alameda. Additionally, he was promised that Alameda had no preferential treatment on the FTX platform, even though the hedge fund was one of its top traders. Huang said he was concerned about FTX's lack of a board of directors, but he eventually invested anyway. During cross-examination, Huang said Paradigm pressed Bankman-Fried on the board issue and was told he didn't want investors as directors but he did plan on having a board with experts. — CNBC's Dawn Giel contributed to this report.","Sex, Signal messages, and sabotaging FTX's code: SBF execs and Bahamas roommates tell all in court",https://www.cnbc.com/2023/10/06/sex-signal-messages-and-sabotaging-ftxs-code-sbf-criminal-trial.html,Cnbc | World Business News Leader
