category,author,published_at,body,title,url,source
business,Stan Choe,2023-10-01T18:19:08+00:00,"Treasury Wine Estates (down 1.9 per cent) and Woolworths (down 1.2 per cent) dragged the consumer staples sector (down 1.1 per cent) lower. Pilbara Minerals (down 2.1 per cent) and Qantas (down 1.5 per cent) were also among the biggest large-cap decliners. The lowdown Stronger iron ore prices helped to bolster the local bourse on Monday but not enough to offset the prospect of higher-for-longer interest rates ahead of the Reserve Bank’s meeting on Tuesday. Iron ore heavyweights advanced after the iron ore price increased 1.4 per cent overnight with lithium miner Liontown resisting the downward momentum of lithium prices, which dropped to the lowest level in two years.

Most sectors traded lower but interest-rate sensitive sectors including healthcare and consumer companies were among the weakest amid expectations that the RBA will keep rates on hold in October. The National Australia Bank has forecast another rate hike to 4.35 per cent in November. Elsewhere, Wall Street closed out its worst month and quarter of the year with more losses on Friday. The S&P 500 slipped 0.3 per cent and the majority of stocks within the index sank. The Dow Jones fell 0.5 per cent and the Nasdaq composite edged 0.1 per cent higher. The Australian sharemarket is set to retreat, with futures pointing to a fall of 38 points, or 0.5 per cent, at the open. Solid gains for stocks early on faded as pressure built from within the bond market. After easing earlier in the day on encouraging signals about inflation, Treasury yields got back to rising as the day progressed. The yield on the 10-year Treasury yield returned to 4.58 per cent, where it was late Thursday, after dipping to 4.52 per cent. It’s again near its highest level since 2007.

Loading Treasury bonds are seen as some of the safest investments possible, and when they pay higher yields, investors are less likely to pay high prices for stocks and other riskier investments. That’s a big reason why the S&P 500 dropped 4.9 per cent in September to drag what had been a big gain for the year down to 11.7 per cent. Treasury yields have been climbing sharply as Wall Street accepts a new normal where the Federal Reserve is likely to keep interest rates high for longer. The Fed is trying to push still-high inflation down to its target, and its main tool of high interest rates does that by trying to slow the economy and hurting prices for investments. The Fed’s main interest rate is at its highest level since 2001, and the central bank indicated last week it may cut interest rates next year by less than it earlier expected. Friday’s economic data shows that not only was inflation a touch cooler than expected in August, so was growth in spending by US consumers. That can be a positive for inflation because it means not as many dollars are pouring into purchases. That in turn could give companies less encouragement to try to raise prices further. But it may also dent what’s been a big driver keeping the US economy out of a recession.

“It came to a boil during a hot summer, and the temperature is really starting to come down,” said Brian Jacobsen, chief economist at Annex Wealth Management, of spending growth by US consumers. “Higher energy prices, student loan debt repayments and real disposable incomes that have been on a declining trajectory since June doesn’t bode well.” Oil prices have jumped to their highest level in more than a year, which is pressuring the economy by raising fuel costs for everyone. A barrel of US crude sank 92¢ Friday to settle at $US90.79, but it’s still up sharply from $US70 in June. Brent crude, the international standard, also weakened. The resumption of US student-loan repayments, meanwhile, may funnel more dollars away from the spending by consumers that has helped to keep the economy afloat. The latest monthly update on the US jobs market is due next week, with a couple of important reports on inflation coming the following week. Postponements of such reports could complicate things for the Fed, which has insisted it will make upcoming decisions on interest rates based on what incoming data say about the economy. The Fed’s next meeting on rates ends on November 1. On Wall Street, Nike jumped 6.7 per cent after reporting better profit for the latest quarter than analysts expected. Strength overseas helped it make up for some declines in North America.

Loading Blue Apron soared 134.5 per cent after the meal kit company said it was being bought by Wonder Group for $US13 per share in cash in a deal valued at $US103 million ($160.2 million). On the losing end of Wall Street were stocks of energy producers, hurt by the slide in oil’s price. Energy stocks in the S&P 500 fell 2 per cent as a group, more than double the loss of any of the other 10 sectors that make up the index. ExxonMobil fell 1.6 per cent, and Schlumberger dropped 4.3 per cent. Energy stocks, though, remain the market’s standout performers since the summer. Shares of Ford and General Motors slipped after the United Auto Workers said it would expand its limited strike to include another facility for each. Ford fell 1.1 per cent, and GM dipped 0.6 per cent.

All told, the S&P 500 slipped 11.65 points to 4288.05. The Dow dropped 158.84 to 33,507.50, and the Nasdaq added 18.05 to 13,219.32. In sharemarkets abroad, indexes were modestly higher in Europe after exchanges were closed across much of Asia. Tweek of the day Quote of the day",ASX set to open lower as Wall Street closes September with more losses,https://www.smh.com.au/business/markets/asx-set-to-open-lower-as-wall-street-closes-september-with-more-losses-20231002-p5e8zn.html?ref=rss&utm_medium=rss&utm_source=rss_business,The Sydney Morning Herald
business,Will Daniel,2023-10-06T20:05:26+00:00,"Housing market pessimists have been sounding the alarm for years about a pending crash in the U.S. residential real estate market. Even before the Federal Reserve began hiking interest rates to fight inflation last year, pushing mortgage rates to a 23-year high this month, years of surging home prices left some experts warning that the housing market was a massive bubble ready to pop.

However, despite a widely bearish outlook in the industry, most real estate veterans have avoided arguing that home prices will drop like they did during the 2008 crash that kicked off the Global Financial Crisis (GFC). And so far, that’s been a wise decision.

It took until June 2022 for national home prices to peak, even as mortgage rates soared and purchase applications plummeted amid the Fed’s first interest rate hikes. And while prices fell more than 5% from that peak by January of this year, they returned to a record high in July.

Still, a Bank of America team led by U.S. economist Jeseo Park warned this week that there’s more “turbulence” coming for the housing market due to high mortgage rates. They explained that they’re getting an eerie feeling of “déjà vu,” but it’s not 2008 that is coming to mind, it’s the 1980s.

“Looking back at previous housing recessions, we think the 1980s are a better analogy for today’s market than the 2008 housing crash,” they wrote in a Thursday note.

This isn’t 2008

While the housing crash of 2008—fueled by the collapse of subprime mortgages—haunts the memories of many Americans, the real estate market of that era was very different from what Bank of America’s experts see today.

Park and her team noted that there are no “noticeable signs” of excess housing development today like there were back then, and households aren’t nearly as burdened by mortgage debt. Household mortgage debt represented roughly 65% of U.S. consumers’ disposable income in the second quarter, compared to 100% before the GFC. And the ratio of Americans’ mortgage debt to their real estate assets—also called loan-to-value—was just 27% in the second quarter, compared to over 40% in 2008 and roughly 50% in 2010, Bank of America’s data shows.

New legislation was also enacted since the GFC to help prevent worst-case scenarios in the housing market. One of the most obvious effects of these new laws is that there are far fewer risky adjustable-rate mortgages today. Adjustable-rate mortgages can lead to higher default rates when interest rates rise, but they now represent less than 5% of total purchase and refinance loans, compared with over 35% at the peak of the pre-GFC housing cycle.

“We reiterate that we do not expect another housing crash like 2008,” Park and her team concluded after presenting this evidence.

Is it a repeat of the ‘turbulence’ of the 1980s?

According to Bank of America, today’s housing market looks a lot more like the early 1980s than it does 2008. Back then, just like today, home prices had boomed for years before Fed officials were ultimately forced to hike interest rates aggressively in an attempt to fight inflation.

The rise in the consumer price index peaked at around 14% in 1980 before then–Fed Chair Paul Volcker’s hawkish policies sent mortgage rates to 18% in a year’s time, cooling inflation, but sparking a recession. This caused a serious downturn in the housing market in which home sales and building levels cratered. However, national home prices actually remained stable.

At the start of Volcker’s term as Fed chair in August 1979, the median U.S. home sales price was $64,700. And even after a near doubling of mortgage rates, that figure rose to $69,400 by the second quarter of 1981.

Over the past 18 months, the Fed’s current chair, Jerome Powell, has been following a very similar game plan to Volcker’s, raising interest rates aggressively to quash inflation. The average 30-year fixed mortgage rate, the most common type of mortgage in the U.S., has soared from 3.8% in March 2022 to over 7.5% today as a result. This, in turn, has slowed mortgage purchase applications and caused home sales to plummet, just as it did in the ’80s; but home prices, echoing the dynamic of that era, have yet to collapse.

One of the key reasons for the resilience of the housing market in both of these periods is demographics. “Noticeably, demographics were favorable back then, with baby boomers having entered the prime homebuying age,” Park and her team wrote Thursday, arguing millennials are in a similar position today. “Some sales activity should be supported by millennials reaching the prime homebuying age, and single-family building permits have steadily held up. This can help the housing market retain some of its momentum without falling apart.”

Bank of America economists believe that low inventory of existing homes for sale combined with solid home sales to millennials could help put a “floor beneath home prices,” but that doesn’t mean there won’t be some near-term pain due to higher mortgage rates.

“With rates likely staying higher for longer, we are cautious of potential turbulence ahead,” the group warned. Bank of America has previously forecast 0% home price growth and falling home sales for the full year 2023, but it didn’t offer a new prediction in its latest note.

Eventually, as inflation fades leading the Fed to cut interest rates, housing affordability will improve. “At that stage, we should see a more stable and healthy housing market,” Park and her team wrote. “Until then, hang tight, it may be a bumpy ride.”

This article has been updated to correct a mistaken term used to refer to Jeseo Park. We regret the error.","Buckle up for more ‘turbulence’ in the housing market, BofA says—it’s a housing recession, 1980s style",https://fortune.com/2023/10/06/home-price-outlook-bank-of-america-housing-recession-turbulence-1980s-not-2008/,Fortune
business,,2023-10-07T15:37:43+00:00,"Hamas' surprise attack on Israel has shocked many who are now questioning the country's famed intelligence agency Mossad, which is known for its intelligence-gathering capability. For some, the belief that Mossad was among the best in the spying world was shattered today when Hamas carried out the biggest coordinated attack in Israel and captured some territory in southern Israel. It is not the attack that has surprised people but the scale at which Hamas operated and got control of some military bases and soldiers.

Also Read: Israel at war: Hamas cells, military compounds destroyed, US backs Tel Aviv; all you need to know

Younis Tirawi, who reports on Palestinian Affairs, said that Hamas militants had taken over Sderot police HQ and armored vehicles in the town. An analyst wrote that some of the images coming out of Sderot over the last few hours were reaching degrees of horror ""that I don't really think I can use words to properly describe. Truly disturbing acts of terror directed at civilians"".

Some of the images coming out of Sderot over the last few hours are reaching degrees of horror that I dont really think I can use words to properly describe. Truly disturbing acts of terror directed at civilians. — OSINTtechnical (@Osinttechnical) October 7, 2023

Commenting on the coordinated attack, Rania Khalek, a journalist, said that the strategic planning that must have gone into this against ""one of the most high-tech occupation and surveillance systems in the world"" will be studied by many. ""The Israelis must be totally losing it right now.""

the strategic planning that must have gone into this against one of the most high tech occupation and surveillance systems in the world will be studied by many, the Israelis must be totally losing it right now https://t.co/oUX2rokEjh — Rania Khalek (@RaniaKhalek) October 7, 2023

Tarik Cyril Amar said: ""And the intel, and the special forces training... both areas where Israel mythology will be very upset indeed.""

And the intel, and the special forces training... both areas where Israel mythology will be very upset indeed. — Tarik Cyril Amar (@TarikCyrilAmar) October 7, 2023

Mjoachim, another user, said that Israel's defence forces have lost their fame. He said the IDF lost an army base, a general was captured right out of his house. ""Invincible ""Merkava MK4 MBT's captured, and destroyed...what is wrong with the Israeli security and defence forces? And (what) MOSSAD did?""

Dr Jaswant Gandhi, a professor of management, said that attack on Israel was a ""great Mossad failure"". He said India had to learn a lot and keep all intelligence agencies duly greased and internecine conflict-proof. ""Israel_under_attack Great #Mossad failure. GoI has to learn a lot and keep all Intelligence Agencies duly greased and internecine conflict-proof. BHARAT is not immune to #terrorism and internal enemies,"" he wrote on X.

#Israel_under_attack Great #Mossad failure. GoI has to learn a lot and keep all Intelligence Agencies duly greased and internecine conflict proof. BHARAT is not immune to #terrorism and internal enemies @HMOIndia @PMOIndia @AmitShah — Dr. Jaswant Gandhi 🇮🇳 (@JaswantDr) October 7, 2023

However, some speculated that Mossad knew what was going to happen but let Hamas make a mistake so that Israel could launch a ferocious attack on it. ""Mossad was not so ignorant that it did not know about this #attack. Israel wanted to invade Palestine, but they had no excuse, stupid #Hamas gave them the reason. Hamas is an excuse, new lands are wonderful,"" a user said.

#Mossad was not so ignorant that it did not know about this #attack. Israel wanted to invade Palestine, they had no excuse, stupid #Hamas gave them the reason. Hamas is an excuse, new lands are wonderful



I definitely support Israel pic.twitter.com/AbLdeazQjR October 7, 2023

Israeli Prime Minister Benjamin Netanyahu said that since this morning, Israel had been at war and its first objective was to clear out the hostile forces that infiltrated its territory. ""The second objective, at the same time, is to exact an immense price from the enemy, within the Gaza Strip as well,"" he said, adding that the third objective was to reinforce other fronts so that nobody should mistakenly join this war. ""We are at war. In war, one needs to be level-headed. I call on all citizens of Israel to unite in order to achieve our highest goal – victory in the war,"" Netanyahu said.

Since this morning, the State of Israel has been at war. Our first objective is to clear out the hostile forces that infiltrated our territory and restore the security and quiet to the communities that have been attacked.



The second objective, at the same time, is to exact an… pic.twitter.com/MzKs7tfv4M — Benjamin Netanyahu - בנימין נתניהו (@netanyahu) October 7, 2023

Reacting to this, however, a user said that knowing the proficiency of the Mossad he found the idea of a ""surprise attack"" to be a willing lie.

Well, you got the war you wanted Beni...at what cost of Israeli lives you don't care. Knowing the proficiency of the Mossad I find the idea of a ""surprise attack""to be a willing lie on your side of this. https://t.co/35qRvgBJt2 — timm (@timmainsson) October 7, 2023

Ben Muasya, a journalist, said that Mossad is overrated. ""How come they never knew Hamas militants planned a sudden attack on Israel? Or was it a trap to get a reason to retaliate heavily? We wait to see how it goes but it will be messy.""

Mossad is overated how comes they never knew this Hamas militants and had planned a sudden attack on Israel? Or was it a trap to get a reason to retaliate heavily?We wait to see how it goes but it will be messy. pic.twitter.com/W5vpoylus2 — Ben Muasya. (@muasya_ben) October 7, 2023

Another user said that no one can carry out such a major attack against Israel without intelligence support. ""Who gave Hamas Intelligence? It was as if the entire Israeli army and the Mossad were asleep.""",&#039;Massive intel failure by Mossad&#039;: Hamas&#039; surprise attack on Israel shocks internet,https://www.businesstoday.in/latest/world/story/massive-intel-failure-by-mossad-hamas-surprise-attack-on-israel-shocks-internet-401106-2023-10-07?utm_source=rssfeed,Business Today | Latest Stock Market And Economy News India
