category,author,published_at,body,title,url,source
business,Stan Choe,2023-09-26T19:11:30+00:00,"ETF provider Betashares, which manages $30 billion in funds, reached an agreement to acquire Bendigo and Adelaide Bank’s superannuation business, in its first venture into the superannuation sector. Betashares said it was part of a longer-term strategy to expand the business into the broader financial sector. Shares in Bendigo increased 0.6 per cent on the news. REITS (up 0.4 per cent) was the strongest sector on the index as Goodman added 0.5 per cent and Dexus climbed 2.8 per cent. The laggards Casino operator Star Entertainment Group’s shares hit an all-time low of 60¢ after it raised $565 million. They closed the session 16 per cent weaker at 63¢. Star, which raised $800 million in February, has had to return to the market for fresh funding and is hoping to raise $750 million at a share price of 60¢ a share.

Meanwhile, healthcare heavyweight CSL shed 1.4 per cent, weighing down the healthcare sector and insurance companies IAG (down 2.6 per cent) and Suncorp (down 2 per cent) gave back some of their gains from Tuesday. Gold miners Newcrest (down 2.1 per cent) and Evolution (down 3.5 per cent) were also among the biggest large-cap decliners after the spot gold price dropped 0.9 per cent overnight. Information technology (down 1.1 per cent) was the weakest sector on the local bourse with WiseTech losing 1.4 per cent. The lowdown

Novus Capital senior client adviser Gary Glover said the Australian sharemarket was surprisingly resilient following a negative lead from Wall Street and the latest inflation data, with markets starting to wake up to the fact that interest rates could stay higher for longer. “Considering the damage overnight in the US, Australian markets held on pretty well,” he said. “I thought it would be a bigger down day across the board.” Glover said the market was volatile but quite range-bound, similar to previous periods of high inflation in the 1940s and 1970s. Elsewhere, Wall Street’s ugly September got even worse on Tuesday, as a sharp drop for stocks brought them back to where they were in June. The S&P 500 tumbled 1.5 per cent for its fifth loss in the last six days. The Dow Jones dropped 1.1 per cent, and the Nasdaq composite lost 1.6 per cent.

Loading September has brought a loss of 5.2 per cent so far for the S&P 500, putting it on track to be the worst month of the year by far, as the realisation sets in that the Federal Reserve will indeed keep interest rates high for a long time. That growing understanding has sent yields in the bond market to their highest levels in more than a decade, which in turn has undercut prices for stocks and other investments. Treasury yields rose again on Tuesday following a mixed batch of reports on the economy. The yield on the 10-year Treasury edged up to 4.55 per cent from 4.54 per cent late on Monday and is near its highest level since 2007. It’s up sharply from about 3.5 per cent in May and from 0.5 per cent about three years ago. One economic report on Tuesday showed confidence among consumers was weaker than economists expected. That’s concerning because strong spending by US households has been a bulwark keeping the economy out of a long-predicted recession.

Besides high interest rates, a long list of other worries is also tugging at Wall Street. The most immediate is the threat of another US government shutdown as Capitol Hill threatens a stalemate that could shut off federal services across the country. Loading Wall Street has dealt with such shutdowns in the past, and stocks have historically been turbulent in the run-up to them, according to Lori Calvasina, strategist at RBC Capital Markets. After looking at the seven shutdowns that lasted 10 days or more since the 1970s, she found the S&P 500 dropped an average of roughly 10 per cent in the three months heading into them. But stocks managed to hold up rather well during the shutdowns, falling an average of just 0.3 per cent, before rebounding meaningfully afterward. Wall Street is also contending with higher oil prices, shaky economies around the world, a strike by US autoworkers that could put more upward pressure on inflation and a resumption of US student-loan repayments that could dent spending by households.

On Wall Street, the vast majority of stocks fell under such pressures, including 90 per cent of those within the S&P 500. Big Tech stocks tend to be among the hardest hit by high rates, and they were the heaviest weights on the index. Apple fell 2.3 per cent and Microsoft lost 1.7 per cent. Amazon tumbled 4 per cent after the Federal Trade Commission and 17 state attorneys general filed an antitrust lawsuit against it. They accuse the e-commerce behemoth of using its dominant position to inflate prices on other platforms, overcharge sellers and stifle competition. In China, concerns continued over heavily indebted real estate developer Evergrande. The property market crisis there is dragging on China’s economic growth and raising worries about financial instability. France’s CAC 40 fell 0.7 per cent, and Germany’s DAX lost 1 per cent.

Crude oil prices rose, adding to worries about inflation. A barrel of benchmark US crude climbed 71¢ to $US90.39. Brent crude, the international standard, added 67¢ to $US93.96 per barrel. Tweet of the day Quote of the day “The Senate committees have the power to summons witnesses within Australia but have no enforceable powers for witnesses who are overseas,” said Senator Bridget McKenzie as former Qantas boss Alan Joyce chose not to front the Senate select committee into the federal government’s decision to reject extra flights from Qatar Airways due to “personal commitments”.",ASX set to drop as Wall Street’s September slump deepens,https://www.smh.com.au/business/markets/asx-set-to-drop-as-wall-street-s-september-slump-deepens-20230927-p5e7v7.html?ref=rss&utm_medium=rss&utm_source=rss_business,The Sydney Morning Herald
business,,2023-10-06T21:31:00+00:00,"A worker sorts out parcels in the outbound dock at the Amazon fulfillment center in Eastvale, California, on Aug. 31, 2021. Watchara Phomicinda | MediaNews Group | The Riverside Press-Enterprise via Getty Images

It was late in the day on Oct. 27, 2021, when Fred Ruckel received the dreaded automated email from Amazon . Amazon’s software had detected that Ruckel’s popular cat toy, called the Ripple Rug, was being sold somewhere else for a cheaper price. His product would no longer be shown in Amazon’s all-important buy box, an area of the listing where shoppers click “Add to Cart.” Ruckel is the sole seller of the Ripple Rug on Amazon, so the move all but ensured his product would disappear from the website, costing him thousands of dollars per day. “Below is a list of product(s) in your catalog that are not currently eligible to be the Featured Offer because they are not priced competitively compared to prices for those products from retailers outside Amazon,” according to the email, which was viewed by CNBC. Unbeknownst to him, Chewy was running a discount promotion, and dropped the price of his product by a few dollars to $39.99 – less than the $43 offer on Amazon. The algorithm had flagged it as a lower offer, even though the item on Chewy cost $48.54 after shipping and taxes. Ruckel had to make a choice: Lower the price on Amazon or ask Chewy to raise the price of his product. He opted for the latter.

Fred Ruckel's company Snuggly Cat makes Ripple Rug, an interactive play mat for cats. Fred Ruckel

Nearly three years later, Ruckel’s experience hits at the core of a sweeping antitrust lawsuit filed last week by the Federal Trade Commission against Amazon. The agency accused Amazon of wielding its monopoly power to squeeze merchants and thwart rivals. For consumers, that’s led to artificially inflated prices and a degraded shopping experience, the agency alleges. In the 172-page suit, the FTC said Amazon relies on an “anti-discounting strategy” and a “massive web-crawling apparatus that constantly tracks online prices” to stifle competition. The agency said Amazon punishes third-party sellers who offer cheaper products elsewhere by threatening to disqualify them from appearing in the buy box if it detects a lower price. Losing the buy box is an “existential threat” to sellers’ businesses, the complaint alleges. The end result of these tactics, the FTC argues, is elevated prices across the web. The company steadily hikes the fees it charges sellers and prevents them from discounting on other sites, so sellers often inflate their prices off of Amazon, creating an “artificial price floor everywhere,” according to the complaint. The FTC is seeking to hold Amazon liable for allegedly violating anti-monopoly law, though it has not yet outlined the specific remedies it believes would best resolve its concerns. In antitrust cases, remedies are often determined only after a court finds the defendant liable. In a blog post, Amazon general counsel David Zapolsky said third-party sellers set their own prices on the marketplace. The company also invests in tools to help sellers offer “competitive prices,” he said. “Even with those tools, some of the businesses selling on Amazon might still choose to set prices that aren’t competitive,” Zapolsky said. “Just like any store owner who wouldn’t want to promote a bad deal to their customers, we don’t highlight or promote offers that are not competitively priced.” Zapolsky argued the FTC’s lawsuit could force it to stop highlighting low prices, “a perverse result that would be directly opposed to the goals of antitrust law.”

“Long overdue” lawsuit

On Amazon’s own forum for merchants, called Seller Central, several users cheered on the FTC and said they hoped it would result in changes to the company’s business practices. Amazon’s tense relationship with merchants has been well-chronicled over the years, with sellers expressing a range of grievances over issues like rising fees, an arcane suspensions process, and heightened competition on the marketplace from all sides, including the e-commerce giant. “I think it’s great, Amazon deserves it,” one person commented, adding, “More should be coming on the way.” Amazon in recent years made the forum anonymous, but users must have a seller account in order to post. Another post included a screenshot of a message Amazon sent to sellers the day after the FTC filed its complaint, which said, “As your partners, we know that this news may generate questions for you and our business together. This lawsuit does not change anything about our relationship with you or how we operate today.” One user called it “BS verbiage,” adding, “Businesses that sell in their store are indeed customers. And which of us has gotten good customer service?” Another user described their experience in the last 12 months of selling on Amazon as “being up all night at an effing casino but I'm stuck, the drugs are starting to wear off, but I'm trying to break even on the mortgage payment I'm using to play. That's how it is selling on Amazon right now to me.” The seller went on to describe the experience as a “race to the bottom.” “It's long overdue,"" another commenter wrote. ""When they close me down, I'm applying for a job with the FTC.” Still, others commented that the FTC’s complaint is misguided. “Selling on Amazon is a life-changing opportunity and the amount of sellers that throw stones at the platform is astounding,” one user wrote.

Seller skepticism

Even sellers who may be sympathetic to the idea of regulating Amazon have concerns, specifically that the FTC's highlighted issues aren't necessarily ones that would make the seller and consumer experience better. Scott Needham, who sells on Amazon and runs a product-finder tool for other Amazon sellers, said he was “surprised by some of the points that the FTC selected.”

watch now

“I have over the years been very critical of Amazon,” Needham told CNBC. “I’ve lost a lot of sleep because of some of the things that they have done. And the issues that they brought up, while they are interesting, they haven’t created me a lot of pain.” Needham said he was particularly puzzled by the inclusion of the claims that Amazon is coercive in the way it encourages sellers to use its fulfillment service, known as Fulfillment by Amazon, or FBA. Needham said many sellers “love FBA” because of its compelling value in terms of the price and promise to deliver two-day shipping. For many, using FBA doesn’t feel like a requirement, but they believe using it will make their businesses ""easier and more effective."" ""I think that the power that Amazon wields over sellers is considerable and absolutely worth looking into,” Needham said. “But I’m not sure if this would actually change that.” Scott Moller, an Amazon seller and co-founder of an agency that helps merchants run their storefronts, said the e-commerce giant has removed some of the challenges that used to be part of running an online business. With FBA, he said, he can ship an item into one of Amazon’s warehouses for $7.49 per package, while shipping it himself through a traditional carrier would cost him about $12. “I don’t have to have my own warehouse,” said Moller, who sells grilling accessories on Amazon under the brand Grill Sergeant. “I can use their staff, their storage, and I can instantly also take the data of advertising, so I can target ads.” He also disputed the FTC’s claim that Amazon has become littered with ads in search results, causing shoppers to wade through potentially less-relevant products of lesser quality. “We can tailor our ads to hit exactly the consumers we want,” Moller said. “It’s a perfect marriage of a transaction, and that’s one of the beauties of what their marketplace offers.” Needham said he feels he would have been more supportive of the case if it were filed a few years ago, pre-pandemic. At that time, he said, ""I would have felt, yes Amazon is a monopoly… But actually after Covid, into 2023, ecommerce has had a lot of big changes.” He added, ""The competition is just not what it was in 2019."" Competitors like Shopify and Walmart are increasingly viable alternatives for many categories of sellers, Needham said, not to mention rapidly growing Chinese e=commerce companies like Temu. As a result, Needham said he’s seen some significant changes from Amazon. Among those is a greater ability for Amazon sellers to communicate with buyers, offering select customers certain promotions. Shopify, for example, gives sellers much more control over how they communicate with customers, Needham said, adding that although Amazon still controls the communication process, at least there is one. ""I wish it was a clear-cut case,” Needham said. “I have a vested interest in the marketplace doing really well, as a seller and as a service provider. And... this case, it doesn’t make the marketplace better for sellers.""

Concerns over Amazon pricing policies, fees

Many sellers have zeroed in on Amazon’s pricing policies and rising fees as rightful areas of concern in the FTC's lawsuit. Molson Hart, whose company Viahart sells toys on Amazon, has been a longtime critic of Amazon’s pricing policies. Hart complained of how Amazon’s seller fees impact pricing in a 2019 Medium post and later that year testified about his experience before a House committee. Hart said Amazon sales comprise about 90% of his business, meaning any hit those sales take on Amazon has a considerable impact. He recalled “24 anxious hours” in September 2022 when a third-party seller of his popular construction toy Brain Flakes listed the toy for a lower price on Target than it was offered on Amazon.

Molson Hart, CEO of Viahart, an educational toy company that sells on Amazon. Courtesy: Molson Hart",Amazon sellers sound off on the FTC's 'long-overdue' antitrust case,https://www.cnbc.com/2023/10/06/amazon-sellers-sound-off-on-the-ftcs-long-overdue-antitrust-case.html,Cnbc | World Business News Leader
