category,author,published_at,body,title,url,source
business,Stan Choe,2023-12-05T21:51:55+00:00,"Loading Perpetual climbed 6.3 per cent after it announced a strategic review of its three-pronged corporate structure that might see it demerge its corporate trust and wealth management businesses and create a more focused asset manager. Shares in Endeavour lifted 2.4 per cent after it forecast earnings before interest and tax in its hotels division would grow by more than $150 million over the next five years. The laggards Utilities and energy stocks were the weakest performers on the local bourse, rising 0.6 per cent and 0.8 per cent, respectively.

Only five large-cap stocks declined, with Evolution Mining sinking a mammoth 13 per cent after it raised $525 million selling new shares to institutional investors at $3.80 a share. The mining sector, however, managed to finish in positive territory. Gold miner Newmont was down 1.25 per cent, Origin Energy fell 0.4 per cent, Mercury Nz declined 0.3 per cent and Argo Investments traded 0.1 per cent lower. The lowdown Moomoo market strategist Jessica Amir said the local sharemarket outperformed global equities on Wednesday because of the National Accounts figures, which pointed to the Reserve Bank potentially hitting pause on lifting interest rates. “We know economic growth is slowing, Australian unemployment is likely to pick up next year and inflation is likely to fall,” Amir said. “The good news is that all of these three things, the trifecta, is pointing towards the RBA stopping rising interest rates and then potentially moving to cut interest rates. This is what the market has priced in today.”

The local gains came after most stocks slipped on Wall Street overnight, although the US market stayed near its highest level in 20 months following a mixed set of reports that kept alive questions about whether the world’s largest economy can pull off a perfect landing where it kills high inflation, but avoids a recession. The S&P 500 edged down by 0.1 per cent for its first back-to-back loss since October. The Dow Jones slipped 0.2 per cent and the Nasdaq composite rose 0.3 per cent. Stocks were down more sharply in Asia amid worries about the health of China’s economy, the world’s second largest. US stocks and Treasury yields wavered after reports showed that US employers advertised far fewer jobs at the end of October than expected, while growth for services businesses accelerated more last month than expected. Hope has been rising on Wall Street recently that the US economy is slowing from its recent hot pace by just the right amount. Too much strength would give inflation more fuel, but too little would mean a recession.

With inflation down from its peak two summers ago, Wall Street is hopeful that the Federal Reserve may finally be done with its market-shaking hikes to interest rates and could soon turn to cutting them. That could help the economy avoid a recession and give a boost to all kinds of investment prices. Investors have been looking for a slowdown in the job market in particular. The hope is that it can cool more through employers cutting back on open positions than on employers laying off workers. Tuesday’s report showed that employers advertised just 8.7 million jobs on the last day of October, down by 617,000 from a month earlier. In the bond market, US Treasury yields continued to sag further from the heights they reached during late October. The yield on the 10-year Treasury fell to 4.18 per cent from 4.26 per cent late on Monday, offering more breathing space for stocks and other markets. It had been above 5 per cent, and at its highest level in more than a decade, during October. The yield on the two-year Treasury, which more closely tracks expectations for the Fed, went on a jagged run following the economic reports. It fell from 4.61 per cent just before the reports’ release to 4.57 per cent and then yo-yoed before easing back to 4.57 per cent.

Loading Traders widely expect the Federal Reserve to hold its key interest rate steady at its meeting next week, before potentially cutting rates in March, according to data from CME Group. Fed officials have recently hinted that the federal funds rate may indeed already be at its peak. It’s above 5.25 per cent, up from nearly zero early last year. But Fed Chair Jerome Powell and others have also warned Wall Street about being overzealous in its predictions about how early a cut could happen. Lower yields have been one reason prices for cryptocurrencies have been rising recently. Excitement about a possible exchange-traded fund tied to bitcoin, which would open it to new kinds of investors, has also helped send it above $US43,000 ($65,600) recently. The surge of interest helped Robinhood Markets report a roughly 75 per cent jump in trading volumes for crypto during November from a month earlier. It also said customers added about $US1.4 billion in net deposits during the month, and its own stock rose 10.3 per cent.

On the losing end of Wall Street was Take-Two Interactive, which slipped 0.5 per cent after a trailer for its highly anticipated Grand Theft Auto VI video game said it’s coming in 2025. That was later than some analysts expected. Tweet of the day Quote of the day IAG chief executive Nick Hawkins said the behaviour of Peter Horton, the insurer’s group general counsel and company secretary, didn’t meet expectations set out in its employee code of ethics and conduct. “This includes the importance of being inclusive and respectful, and we will hold people to account if they fail to meet these expectations,” Hawkins said.",ASX set for bright start despite Wall Street slip; $A drops,https://www.smh.com.au/business/markets/asx-set-for-bright-start-a-drops-20231206-p5epbi.html?ref=rss&utm_medium=rss&utm_source=rss_business,The Sydney Morning Herald
business,Stan Choe,2023-10-04T21:01:01+00:00,"On the small-cap front, Melbourne-based biotech Dimerix more than doubled its share price to 16¢ on Thursday after the company revealed it had inked an exclusive licensing deal to commercialise its treatment for a kidney disease called Focal Segmental Glomerulosclerosis in Europe, the UK, Switzerland, Canada, Australia and New Zealand. The laggards Meanwhile, energy companies (down 0.9 per cent) were among the weakest on the index as the oil price slumped overnight. Heavyweights Woodside and Santos shed 0.8 per cent and 0.4 per cent, respectively, and Ampol dropped 2.8 per cent. Miners were also weaker, with lithium prospector IGO (down 4 per cent) and Mineral Resources (down 2.9 per cent) among the biggest large-cap advancers. Iron ore giants Rio Tinto (down 1.5 per cent) and BHP (down 0.7 per cent) slipped after the iron ore price fell 1.1 per cent. Aristocrat Leisure (down 3.7 per cent) dragged the consumer discretionary sector (down 0.3 per cent) lower.

The lowdown IG Australia market analyst Tony Sycamore said the ASX received some relief from a rally on Wall Street following the release of cooler-than-expected US economic data which helped cap US bond yields. “Much has been written about the unrelenting rise in long-term US interest rates threatening prospects of a soft landing and raising doubts around equity market valuations,” he said. “This was stopped in its tracks overnight following the release of a considerably weaker employment, and ISM services purchasing managers index data topped off by a 5.6 per cent fall in the price of crude oil to below $85 per barrel.” Sycamore said the property sector and interest rate sensitive technology sector reclaimed some lost ground, while banks advanced on the back of the pullback in yields.

However, iron ore miners were shackled by concerns around the Chinese economy, Sycamore said, as the market braced for China’s consumer purchasing index report next week, which is expected to show inflation remaining morbid. The local rebound came after Wall Street rose after getting some relief from relaxing bond yields and falling oil prices. Loading The S&P 500 climbed 0.8 per cent to claw back more than half its sharp tumble from a day earlier, which sent it to a four-month low. The Dow Jones rose 0.4 per cent, a day after erasing the last of its gains for the year so far. The Nasdaq composite led the market with a gain of 1.4 per cent. Stocks have struggled under the weight of soaring Treasury yields in the bond market. High yields undercut stock prices by pulling investment dollars away from stocks and into bonds. They also crimp corporate profits by making borrowing more expensive.

The yield on the 10-year Treasury, which is the centrepiece of the bond market, pulled back from its highest level since 2007, down to 4.73 per cent from 4.80 per cent late on Tuesday. Shorter- and longer-term yields also eased to allow more oxygen for the stock market. Yields fell following a couple of reports indicating a slowing US economy. The first suggested hiring by employers outside the government was much weaker last month than expected. On Wall Street, that’s currently good news because a cooling job market could mean less upward pressure on inflation. That in turn could convince the Federal Reserve to take it easier on interest rates. After already raising its main interest rate to the highest level since 2001, the Fed has indicated it may keep its overnight rate higher next year than it had earlier expected. Treasury yields have correspondingly snapped higher as traders accept a new normal for markets of high rates for longer. The Fed is paying particular attention to the job market because too much strength there could drive wages for workers much higher, which it fears could keep inflation well above its target of 2 per cent.

Oil prices slumped overnight. Credit: AP Wednesday’s report from ADP suggested private employers added 89,000 jobs last month, a much sharper slowdown in hiring than the 140,000 that economists expected. The report doesn’t have a perfect track record in predicting what the more comprehensive jobs report from the US government will say. That will arrive on Friday. But “if Friday’s report also shows the labour market is cooling, stock investors may worry a little less about indefinitely higher interest rates,” said Mike Loewengart, head of model portfolio construction at Morgan Stanley Global Investment Office. A second report on the economy said growth in US services industries slowed in September by a touch more than economists expected.

It also offered some hints of sticky pressure on inflation, with prices paid by services companies rising last month at a similar rate as in August. Oil prices tumbled on Wednesday to take some heat off inflation. Benchmark US crude fell $US5.01 to settle at $US84.22 per barrel for its worst drop in just over a year. It’s been pulling back since, topping $US93 last week. Brent crude, the international standard, lost $US5.11 to $US85.81. Loading Prices for crude had been generally charging higher from $US70 during the summer, following announcements of cuts to production by some oil-producing countries. Wall Street is also absorbing the ouster of Kevin McCarthy as the speaker of the House of Representatives. The unprecedented move to remove a speaker from the position likely doesn’t change much in the short term, with funding for the US government set until November 17.

“That said, a leadership vacuum in the House raises the odds of a government shutdown when the current funding extension expires,” according to economists at Goldman Sachs. A shutdown would drag on the US economy, raising the risk of a recession, though financial markets have held up relatively well through past shutdowns. On Wall Street, big tech stocks helped to support the market after leading it lower a day earlier. They tend to move more sharply with expectations for rates because high-growth stocks are seen as some of the biggest victims of high yields. In markets abroad, stock indexes were mixed across much of Europe. Tweet of the day

Quote of the day “Last year, Christmas spending was bolstered by a record freedom spending phenomenon with delayed overseas travel, whereas this year shoppers are expected to be much more conservative with their budgets,” said Australian Retailers Association chief Paul Zahra as cost-of-living pressures put a lid on spending, with shoppers tipped to cut back on hospitality, home goods and clothes purchases. You may have missed Qantas’ freight division has suffered a catastrophic system failure that left dead bodies, live animals and perishable food unable to be collected from airports.",ASX set to open higher as Wall Street rebounds; $A rises,https://www.theage.com.au/business/markets/asx-set-to-edge-up-as-wall-street-steadies-a-rises-20231005-p5e9va.html?ref=rss&utm_medium=rss&utm_source=rss_business,The Age
business,Ben Weiss,2023-10-04T23:32:53+00:00,"Who is Sam Bankman-Fried, the former CEO of crypto exchange FTX? Is he a liar and a fraud? Or did he act in good faith, and like many a startup founder, fly too close to the sun?

That answer ultimately lies with the jury, which was selected on Wednesday morning before lawyers for the government and then Bankman-Fried swapped two very different stories of the former crypto mogul’s sudden rise and almost instantaneous fall.

Here’s what happened on the second day of the trial, which featured pointed allegations, a friend from MIT, and an audience replete with big names, including Bankman-Fried’s professorial parents and Damian Williams, U.S. attorney for the Southern District of New York.

A conscious criminal…

The prosecution’s account of the alleged crimes by Bankman-Fried, who spent most of his day in court staring into a laptop while seated between his two attorneys, featured a study in contrasts.

“One year ago, it looked like the defendant was on the top of the world,” began Thane Rehn, a prosecutor for the government, in his opening statement. The former CEO of FTX oversaw a supposedly thriving crypto exchange, jetted between international locales, and hobnobbed with celebrities like Tom Brady and Larry David. He repeatedly emphasized to customers that their money was safe and secure.

But “all of that, all of it, was built on lies,” Rehn declared to the jury. “Behind the curtains, he was not what he appeared to be.” What followed was a roughly 30-minute story that repeatedly emphasized how Bankman-Fried allegedly stole customer funds to facilitate his jet-setting lifestyle, donate millions to political candidates, and finance risky bets.

The key to his alleged scheme? Alameda Research, a crypto hedge fund he also owned, argued Rehn. Using Caroline Ellison, his on-again off-again girlfriend and the CEO of Alameda, as a front, Bankman-Fried had “secret access” to customer money—both cash and crypto—the government claimed.

Moreover, Bankman-Fried allegedly directed employees to conceal the flow of money into FTX’s coffers and forged financial documents distributed to lenders and investors. “The defendant lied to the world,” Rehn alleged.

And who was this defendant? Not a crypto “boy” genius, as so many in the media (Fortune included) have written, but a “man” who “stole billions of dollars from thousands of victims,” Rehn said. “You will see the full picture.”

…or a well-meaning founder?

But Bankman-Fried, whose cheekbones were more prominent after spending about seven weeks in a Brooklyn prison, was no liar, according to Mark Cohen, one of his lawyers. “Sam didn’t defraud anyone,” he said early on in his opening statement.

What the jury will see is a nerdy startup founder who acted in “good faith,” not the prosecution’s “cartoon of a villain.” (Cohen repeatedly harped on Bankman-Fried’s allegedly good-faith actions throughout his address to the jury.)

Alameda was not subterranean or shady. It was a successful hedge fund, he said. FTX was no Ponzi scheme. It was a “very innovative, successful company.” And the business practices between the two were reasonable, he argued, claiming that Alameda acted legally as an FTX customer, payment processor, and market maker, or financial entity that acts as a trading partner for customers looking to buy and sell cryptocurrencies.

In an analogy he employed throughout his opening statement, he said that “working at a startup is like building a plane as you’re flying it” and that businesses sometimes fail. In fact, he specifically pointed the finger at Ellison, the former CEO of Alameda, who, he said, did not adequately protect her hedge fund from the inherent risk of the crypto markets.

When the walls came closing in and the aforementioned plane approached the “eye of the storm,” Bankman-Fried did not act like someone who was guilty. Rather, he was willing to give up his personal wealth to make customers whole, Cohen argued.

“In the end, Sam started and built two billion-dollar businesses,” he concluded. “He didn’t steal any money.”

A Frenchman who lives in London testifies in New York

After lawyers from both sides depicted two very different Bankman-Frieds, the prosecution called its first two witnesses to the stand—and they weren’t blockbuster names or former lieutenants-turned-government-cooperators, like Ellison.

The first was a victim: Marc-Antoine Julliard, a Paris-born cocoa trader who lives in London. In 2021, Julliard, who had coiffed hair and spoke with a strong French accent, decided to invest in crypto and landed on FTX as his exchange of choice, where he traded cryptocurrencies like Bitcoin and Dogecoin.

On Nov. 8, in the crypto exchange’s final few days, he tried to pull out his cash and crypto. How much? Almost $100,000, he said. And was he ever able to? “Never,” he told prosecutors.

Shortly afterward, as the trial neared late afternoon, the government called Adam Yedidia to the stand. A fast-talking graduate of MIT, he and Bankman-Fried were close friends in college, he said. And after Bankman-Fried left Jane Street, the high-frequency trading firm where the former billionaire got his start in finance after MIT, he persuaded Yedidia to join him as a trader at Alameda and then as a developer at FTX.

When Yedidia first took the stand, Danielle Sassoon, one of the lead prosecutors, said that the college friend of Bankman-Fried had legal immunity during his testimony. Why did he make such a deal with the government, she asked.

“I was concerned that I had unwittingly written code that contributed to a crime,” he said.

Soon, however, the clock neared 4:30 p.m., and court adjourned for the day. Yedidia will continue his testimony on Thursday, followed by Matt Huang, a former partner at the high-powered venture capital firm Sequoia Capital, and then Gary Wang, a key Bankman-Fried lieutenant and one of the government’s star witnesses.",Is Sam Bankman-Fried a bad ‘man’ or a good ‘boy’? Lawyers swap opening statements before first witnesses take the stand,https://fortune.com/crypto/2023/10/04/sam-bankman-fried-lawyers-opening-statements-witnesses-marc-antoine-julliard-adam-yedidia-ftx-commodities-trader-developer/,Fortune
